check_id,false_positive_type,check_question,why_it_matters,action_if_true
FP001,APP_OR_WRAPPER_LIMITATION,Was the test run through a third-party app feature rather than raw Yahoo endpoint access?,"The app may transform, filter, or misroute the request.",Classify as LIKELY_APP_SPECIFIC unless raw endpoint evidence confirms Yahoo behavior.
FP002,FULL_URL_AS_SYMBOL,Was a full URL entered into a field intended for ticker symbols?,The app may treat the full URL as a symbol and produce misleading quoteSummary errors.,Do not classify as endpoint failure; document as app/user workflow limitation.
FP003,RATE_LIMIT_OR_BLOCK,"Was HTTP 429, captcha, blocked HTML, or abnormal empty response observed?",Temporary rate limiting can mimic endpoint failure or null results.,Mark NEEDS_RETEST or LIKELY_TEMPORARY_YAHOO_ISSUE.
FP004,BAD_SYMBOL_ENCODING,"Were special symbols like ^GSPC, ZT=F, or EURUSD=X URL-encoded correctly when needed?",Encoding problems can cause missing results unrelated to Yahoo schema changes.,Retest with encoded and unencoded variants; classify as special-symbol issue if persistent.
FP005,WRONG_ENDPOINT_EXPECTATION,Was a screener or search endpoint expected to behave like a quote endpoint?,Different endpoints use different response objects and input parameters.,Correct the endpoint category and parser expectation before review.
FP006,MARKET_STATE_TIMING,"Was the capture taken during premarket, postmarket, postpost, weekend, holiday, or fund NAV update window?","Market state can explain stale, delayed, or absent fields.",Record marketState and retest during regular and post-close periods.
FP007,SINGLE_SYMBOL_ANOMALY,Does the issue affect only one symbol while controls are normal?,Single-symbol issues may be coverage problems rather than schema changes.,Classify as symbol anomaly; retest and compare representative controls.
FP008,DATA_VENDOR_DELAY,"Could the behavior be caused by delayed quotes, fund NAV timing, or quoteSourceName differences?",Delayed data is not necessarily a schema or endpoint change.,Classify under data timing/staleness rather than field change.
